<?xml version="1.0" encoding="UTF-8"?>
<xs:schema xmlns="http://www.uniovi.es" 
	elementFormDefault="qualified" 
	targetNamespace="http://www.uniovi.es" 
	xmlns:xs="http://www.w3.org/2001/XMLSchema">

	<xs:element name="rutas">
		<xs:complexType>
			<xs:sequence>
				<xs:element minOccurs="1" maxOccurs="unbounded" ref="ruta" />
			</xs:sequence>
		</xs:complexType>
	</xs:element>

	<xs:element name="ruta">
		<xs:complexType>
			<xs:sequence>
				<xs:element ref="nombre" />
				<xs:element ref="tipoRuta" />
				<xs:element ref="mtransporte" />
				<xs:element ref="fechaInicio" minOccurs="0" maxOccurs="1" />
				<xs:element ref="horaInicio" minOccurs="0" maxOccurs="1" />
				<xs:element ref="duracion" />
				<xs:element ref="agencia" />
				<xs:element ref="descripcion" />
				<xs:element ref="perAdmitidas" />
				<xs:element ref="linicio" />
				<xs:element ref="dinicio" />
				<xs:element ref="coordenadas" />
				<xs:element ref="bibliografia" />
				<xs:element ref="recomendacion" />
				<xs:element ref="hitos" />
			</xs:sequence>
		</xs:complexType>
	</xs:element>

	<xs:element name="nombre" type="xs:string" />
	<xs:element name="tipoRuta" type="xs:string" />
	<xs:element name="mtransporte" type="xs:string" />

	<xs:element name="fechaInicio" type="xs:date" />
	<xs:element name="horaInicio" type="xs:time" />
	<xs:element name="duracion" type="xs:duration" />

	<xs:element name="agencia" type="xs:string" />
	<xs:element name="descripcion" type="xs:string" />
	<xs:element name="perAdmitidas" type="xs:string" />
	<xs:element name="linicio" type="xs:string" />
	<xs:element name="dinicio" type="xs:string" />

	<xs:element name="coordenadas">
		<xs:complexType>
			<xs:sequence>
				<xs:element ref="longitud" />
				<xs:element ref="latitud" />
				<xs:element ref="altitud" />
			</xs:sequence>
		</xs:complexType>
	</xs:element>

	<xs:element name="longitud" type="xs:float" />
	<xs:element name="latitud" type="xs:float" />
	<xs:element name="altitud" type="xs:float" />

	<xs:element name="bibliografia">
		<xs:complexType>
			<xs:sequence>
				<xs:element minOccurs="3" maxOccurs="unbounded" ref="referencia" />
			</xs:sequence>
		</xs:complexType>
	</xs:element>

	<xs:element name="referencia" type="xs:string" />

	<xs:element name="recomendacion">
		<xs:simpleType>
			<xs:restriction base="xs:integer">
				<xs:minInclusive value="0"/>
				<xs:maxInclusive value="10"/>
			</xs:restriction>
		</xs:simpleType>
	</xs:element>

	<xs:element name="hitos">
		<xs:complexType>
			<xs:sequence>
				<xs:element minOccurs="3" maxOccurs="unbounded" ref="hito" />
			</xs:sequence>
		</xs:complexType>
	</xs:element>

	<xs:element name="hito">
		<xs:complexType>
			<xs:sequence>
				<xs:element ref="hnombre" />
				<xs:element ref="hdescripcion" />
				<xs:element ref="coordenadas" />
				<xs:element ref="distancia" />
				<xs:element ref="fotografias" />
				<xs:element minOccurs="0" maxOccurs="1" ref="videos" />
			</xs:sequence>
		</xs:complexType>
	</xs:element>

	<xs:element name="hnombre" type="xs:string" />
	<xs:element name="hdescripcion" type="xs:string" />

	<xs:element name="distancia">
		<xs:complexType>
			<xs:simpleContent>
				<xs:extension base="xs:string">
					<xs:attribute name="unidades" type="xs:string" use="required" />
				</xs:extension>
			</xs:simpleContent>
		</xs:complexType>
	</xs:element>

	<xs:element name="fotografias">
		<xs:complexType>
			<xs:sequence>
				<xs:element minOccurs="1" maxOccurs="5" ref="fotografia" />
			</xs:sequence>
		</xs:complexType>
	</xs:element>
	<xs:element name="fotografia" type="xs:string" />

	<xs:element name="videos">
		<xs:complexType>
			<xs:sequence>
				<xs:element minOccurs="0" maxOccurs="3" ref="video" />
			</xs:sequence>
		</xs:complexType>
	</xs:element>
	<xs:element name="video" type="xs:string" />
</xs:schema>